{
  "$schema": "https://spec.openmoca.org/schemas/core/sidecar-index.schema.json",
  "manifest_version": "1.0.0",
  "target_package_id": "urn:moca:example:level-1-minimal",
  "target_package_hash": "sha256:2c9d1a433be0d3a491038195e5a624507b1e1fb45b412eb51644d221711db9ef",
  "index_type": "content_addressing_only",
  "chunking": {
    "strategy": "paragraph"
  },
  "item_addressing": {
    "content_path": "content_path",
    "chunk_index": "chunk_index",
    "chunk_count": "chunk_count"
  },
  "storage": {
    "format": "jsonl",
    "file": "payload/index.jsonl"
  }
}
